<?xml version="1.0" encoding="UTF-8"?>
<!--
ldrewe : 0.90 : demo database for the lecture on Linux Days 2014/Berlin 
(C) Karsten Reincke, Deutsche Telekom AG, Darmstadt 2014 

A psiKeds knowledge base: developed for being used by the inference machine
of psiKeds, the purpose system induced knowledge entity delivery system
http://www.psikeds.org/) and generated by the psiKedsXtXKrl-Generator

This file is licensed under the conditions of a/the
CC-BY-SA-4.0

-->
<kb:knowledgebase 
  xmlns="http://org.psikeds.knowledgebase"
  xmlns:kb="http://org.psikeds.knowledgebase"
  xmlns:xsi="http://www.w3.org/2001/XMLSchema-instance"
  xsi:schemaLocation="http://org.psikeds.knowledgebase psikeds.xsd">
  <kb:meta>
    <kb:id>ldrewe</kb:id>
    <kb:name>Linux-Day-Rewe-Demo-Knowledgebase</kb:name>
    <kb:teaser>Linux-Day-Rewe-Demo-Knowledgebase</kb:teaser>
    <kb:release>0.90</kb:release>
    <kb:copyright>Karsten Reincke, Deutsche Telekom AG, Darmstadt 2014</kb:copyright>
    <kb:license>CC-BY-SA-4.0</kb:license>
    <kb:created>2014-05-05</kb:created>
    <kb:lastmodified>2014-05-05</kb:lastmodified>
    <kb:creator>Karsten Reincke</kb:creator>
  </kb:meta>
  <kb:data>

      
    <kb:purposes>
      <kb:purpose id="relishDinner" root="true">
        <kb:label>relish.Dinner</kb:label>
      </kb:purpose>
      <kb:purpose id="addTaste" root="false">
        <kb:label>add:Taste</kb:label>
      </kb:purpose>
      <kb:purpose id="addVitamins" root="false">
        <kb:label>add:Vitamins</kb:label>
      </kb:purpose>
      <kb:purpose id="addProteins" root="false">
        <kb:label>add:Proteins</kb:label>
      </kb:purpose>
      <kb:purpose id="addCarbohydrats" root="false">
        <kb:label>add:Carbohydrats</kb:label>
      </kb:purpose>
    </kb:purposes>

    <kb:variants>
      <kb:variant id="VeggiMeal"
        type="explicit">
        <kb:label>Veggi Meal</kb:label>
      </kb:variant>
      
      <kb:variant id="CarniMeal"
        type="explicit">
        <kb:label>Carni Meal</kb:label>
      </kb:variant>
      
      <kb:variant id="Hollandaise"
        type="explicit">
        <kb:label>Sauce Hollandaise</kb:label>
      </kb:variant>
      
      <kb:variant id="BratenSosse"
        type="explicit">
        <kb:label>Bratenso√üe</kb:label>
      </kb:variant>
      
      <kb:variant id="Spargel"
        type="explicit">
        <kb:label>Spargel</kb:label>
      </kb:variant>
      
      <kb:variant id="Erbsen"
        type="explicit">
        <kb:label>Erbsen</kb:label>
      </kb:variant>
      
      <kb:variant id="Schinken"
        type="explicit">
        <kb:label>Schinken</kb:label>
      </kb:variant>
      
      <kb:variant id="Braten"
        type="explicit">
        <kb:label>Braten</kb:label>
      </kb:variant>
      
      <kb:variant id="Kartoffeln"
        type="explicit">
        <kb:label>Kartoffeln</kb:label>
      </kb:variant>
      
      <kb:variant id="Nudeln"
        type="explicit">
        <kb:label>Nudeln</kb:label>
      </kb:variant>
      
    </kb:variants>  

    <kb:alternatives>
      <kb:fulfills psRef="relishDinner"
        pvRefs="VeggiMeal CarniMeal " />
      <kb:fulfills psRef="addTaste"
        pvRefs="Hollandaise BratenSosse " />
      <kb:fulfills psRef="addVitamins"
        pvRefs="Spargel Erbsen " />
      <kb:fulfills psRef="addProteins"
        pvRefs="Braten Schinken " />
      <kb:fulfills psRef="addCarbohydrats"
        pvRefs="Kartoffeln Nudeln " />
    </kb:alternatives>  
     
    <kb:constituents>
      <kb:constitutes pvRef="VeggiMeal">
        <kb:component psRef="addTaste">
          <kb:quantity>1</kb:quantity>
        </kb:component>
        <kb:component psRef="addVitamins">
          <kb:quantity>1</kb:quantity>
        </kb:component>
        <kb:component psRef="addCarbohydrats">
          <kb:quantity>1</kb:quantity>
        </kb:component>
      </kb:constitutes>  
      <kb:constitutes pvRef="CarniMeal">
        <kb:component psRef="addTaste">
          <kb:quantity>1</kb:quantity>
        </kb:component>
        <kb:component psRef="addVitamins">
          <kb:quantity>1</kb:quantity>
        </kb:component>
        <kb:component psRef="addProteins">
          <kb:quantity>1</kb:quantity>
        </kb:component>
        <kb:component psRef="addCarbohydrats">
          <kb:quantity>1</kb:quantity>
        </kb:component>
      </kb:constitutes>  
    </kb:constituents> 

    
    <kb:events>
      <kb:event id="VeggiMealWithHollandaise" 
        nexusRef="VeggiMeal"
        contextPath="VeggiMeal addTaste"> 
        <kb:label>Veggi Meal mit Hollandaise</kb:label>
          <kb:trigger  type="pv" ref="Hollandaise" />
       </kb:event>
      <kb:event id="VeggiMealWithSpargel" 
        nexusRef="VeggiMeal"
        contextPath="VeggiMeal addVitamins"> 
        <kb:label>Veggi Meal mit Spargel</kb:label>
          <kb:trigger  type="pv" ref="Spargel" />
       </kb:event>
      <kb:event id="CarniMealWithHollandaise" 
        nexusRef="CarniMeal"
        contextPath="CarniMeal addTaste"> 
        <kb:label>Carni Meal mit Hollandaise</kb:label>
          <kb:trigger  type="pv" ref="Hollandaise" />
       </kb:event>
      <kb:event id="CarniMealWithSpargel" 
        nexusRef="CarniMeal"
        contextPath="CarniMeal addVitamins"> 
        <kb:label>Carni Meal mit Spargel</kb:label>
          <kb:trigger  type="pv" ref="Spargel" />
       </kb:event>
      <kb:event id="CarniMealWithSchinken" 
        nexusRef="CarniMeal"
        contextPath="CarniMeal addProteins"> 
        <kb:label>Carni Meal mit Schinken</kb:label>
          <kb:trigger  type="pv" ref="Schinken" />
       </kb:event>
      <kb:event id="CarniMealWithKartoffeln" 
        nexusRef="CarniMeal"
        contextPath="CarniMeal addCarbohydrats"> 
        <kb:label>Carni Meal mit Kartoffeln</kb:label>
          <kb:trigger  type="pv" ref="Kartoffeln" />
       </kb:event>
      <kb:event id="VeggiMealWithKartoffeln" 
        nexusRef="VeggiMeal"
        contextPath="VeggiMeal addCarbohydrats"> 
        <kb:label>VeggiMeal mit Kartoffeln</kb:label>
          <kb:trigger  type="pv" ref="Kartoffeln" />
       </kb:event>
    </kb:events> 
    
    
    <kb:rules>
      <kb:rule id="IFVMwithHoolandaiseTHENVMwithSpargel"
        nexusRef="VeggiMeal"
        premiseRefs="VeggiMealWithHollandaise "
        conclusioRef="VeggiMealWithSpargel" >
        <kb:label>IF VM mit Hoolandaise THEN VM mit Spargel</kb:label>
      </kb:rule>
      <kb:rule id="IFVMwithSpargelTHENVMwithHoolandaise"
        nexusRef="VeggiMeal"
        premiseRefs="VeggiMealWithSpargel "
        conclusioRef="VeggiMealWithHollandaise" >
        <kb:label>IF VM mit Spargel THEN VM mit Hollandaise</kb:label>
      </kb:rule>
      <kb:rule id="IFCMwithHoolandaiseTHENCMwithSpargel"
        nexusRef="CarniMeal"
        premiseRefs="CarniMealWithHollandaise "
        conclusioRef="CarniMealWithSpargel" >
        <kb:label>IF CM mit Hoolandaise THEN CM mit Spargel</kb:label>
      </kb:rule>
      <kb:rule id="IFCMwithSpargelTHENCMwithHoolandaise"
        nexusRef="CarniMeal"
        premiseRefs="CarniMealWithSpargel "
        conclusioRef="CarniMealWithHollandaise" >
        <kb:label>IF CM mit Spargel THEN CM mit Hollandaise</kb:label>
      </kb:rule>
      <kb:rule id="IFCMwithSpargelTHENCMwithSchinken"
        nexusRef="CarniMeal"
        premiseRefs="CarniMealWithSpargel "
        conclusioRef="CarniMealWithSchinken" >
        <kb:label>IF CM mit Spargel THEN CM mit Schinken</kb:label>
      </kb:rule>
      <kb:rule id="IFCMwithSpargelTHENCMwithKartoffeln"
        nexusRef="CarniMeal"
        premiseRefs="CarniMealWithSpargel "
        conclusioRef="CarniMealWithKartoffeln" >
        <kb:label>IF CM mit Spargel THEN CM mit Kartoffeln</kb:label>
      </kb:rule>
      <kb:rule id="IFVMwithSpargelTHENVMwithKartoffeln"
        nexusRef="VeggiMeal"
        premiseRefs="VeggiMealWithSpargel "
        conclusioRef="VeggiMealWithKartoffeln" >
        <kb:label>IF VM mit Spargel THEN VM mit Kartoffeln</kb:label>
      </kb:rule>
    </kb:rules> 
    
  </kb:data>    
</kb:knowledgebase>
